mission,difficulty,title,task,active,requirements

"Menas Motivation 1","1","The Dark Forest","Menas must add at least 1 progress to any Foe at a Wilderness location."
"Thea Motivation 1","1","Stronger Together","Thea must cooperate on a test with Menas and get a 4 or higher."
"Fuscus Motivation 1","1","Wine. And Women. And Men.","Fuscus must add at least 1 progress to any Diplomat."
"Keel Motivation 1","1","The Finest Tools","Sum: 4 xxORE"

"Espionage","1","Vault of Shadows","Overcome the Vault of Shadows","xxIMMEDIATE Attach Vault of Shadows to a vault location.","xxSTARTING Vault location."
"Espionage","1","Drunken Revelry","All guards are at a tavern location.",,"xxSTARTING Tavern location."
"Espionage","1","Safehouse Repairs","Unique: xxFOOD xxLUXURY"
"Espionage","1","Traveling Minstrels","Sum: 4 xxPROGRESS"
"Espionage","1","Right Tool for the Job","Sum: 3 xxORE"
"Espionage","1","Sleeping Draught","Sum: 2 xxMANA"

"Espionage","2","Heavy Bribes","Pair: xxLUXURY xxFOOD"
"Espionage","2","Scrying","Pair: xxMANA xxLUXURY"
"Espionage","2","Funding the Resistance","Unique: xxLUXURY xxMANA xxFOOD"
"Espionage","2","Into the Cold","Sum: 4 xxORE"
"Espionage","2","The Torturer","Overcome Minim",,"xxIMMEDIATE Attach Minim to a xxFIRE location."

"Domain","1","An Outpost in the Dark Forest","Sum: 4 xxPROGRESS"
"Domain","1","Gather Supplies","Sum: 3 xxPROGRESS"
"Domain","1","Roads and Mills","Sum: 3 xxTIMBER 2 xxORE"
"Domain","1","Incant a Ward Against the Deathless","Sum: 2 xxMANA"
"Domain","1","Diadem of Protection","Unique: xxORE xxMANA"
"Domain","1","Minor Repairs","Sum: 2 xxTIMBER"
"Domain","1","Moment of Peace","No Restless Dead in Play",,"xxSTARTING Mirror Woods."

"Domain","2","Deathbane Swords","Sum: 5 xxORE"
"Domain","2","A Kindness for the Captive Shadow","Overcome the Necromancer","xxIMMEDIATE Attach the Necromancer to Undari's Tomb.","xxSTARTING Undari's Tomb."
"Domain","2","Solace for the Victims","Sum: 5 xxPROGRESS"

"Diplomacy","1","Pleas for Unity","Sum: 4 xPROGRESS"
"Diplomacy","1","Discuss the Empire's Military Strategy","Sum: 3 xxPROGRESS and Advance Mission Stage","May not fulfill during the epilogue."
"Diplomacy","1","A Great Feast","Sum: 3 xxFOOD"
"Diplomacy","1","Positive Sentiment Towards Red Bank","No Issues in Play"
"Diplomacy","1","The Secrets of Spirit Lake","Sum: 3 xxMANA",,"Requires: Sprit Lake."
"Diplomacy","1","Moonrider Defenses","Sum: 4 xxPROGRESS"
"Diplomacy","1","Feeding the Lake","Sum: 6 xxPROGRESS"

"Diplomacy","2","Prepare for War","Sum: 7 xxTIMBER"
"Diplomacy","2","The Great House","Pair: xxTIMBER xxMANA"
"Diplomacy","2","Rumors of Smoke and Fire","Pair: xxFOOD xxMANA"

"Tragedy and Conspiracy","1","Breaking the Web","Burn The Weaver","Unlock and play the Weaver of Secrets when this achievement is active.","Sorcery"
"Tragedy and Conspiracy","1","Moment of Peace","No Violent Locals in Play",,"Domain"
"Tragedy and Conspiracy","1","An Eye and an Ear","No Autarch Spies in Play",,"Espionage"
"Tragedy and Conspiracy","1","Wizard's Tower","Spend 7 xxORE",,"Sorcery"
"Tragedy and Conspiracy","1","Hearts and Minds","Spend 6 xxPROGRESS and 4 xxORE",,"Domain"
"Tragedy and Conspiracy","1","Intercepted Plans","Spend 8 xxPROGRESS",,"Espionage"
"Tragedy and Conspiracy","1","A Charm for Yasmina","Spend 3 xxMANA and 6 xxPROGRESS",,"Sorcery"
"Tragedy and Conspiracy","1","Meeting Hall","Spend 4 xxORE and 4 xxTIMBER",,"Domain"
"Tragedy and Conspiracy","1","Reading the Tea Leaves","Spend 3 xxMANA",,"Sorcery"
"Tragedy and Conspiracy","1","Recovering from the Fire","Spend 4 xxORE and 4 xxTIMBER",,"Domain"

"Whispers at Lily Manor","1","Secrets Revealed","Burn Subtect","Unlock and play The Subtect when this achievement is active.","Espionage"
"Whispers at Lily Manor","1","The Leader's Favor","Burn Zarrah","Unlock and play Zarrah and High Society when this achievement is active.","Diplomacy"
"Whispers at Lily Manor","1","Quelling Rumors","No Issues in Play",,"Diplomacy"
"Whispers at Lily Manor","1","Silver Tongued","Spend 8 xxPROGRESS",,"Diplomacy"
"Whispers at Lily Manor","1","Contacts in Burgan Vale","Spend 5 xxPROGRESS and 3 xxMANA",,"Sorcery"
"Whispers at Lily Manor","1","When in Lily Manor","Spend 8 xxPROGRESS",,"Diplomacy"
"Whispers at Lily Manor","1","Wheels within Wheels","Spend 6 xxPROGRESS",,"Espionage"
"Whispers at Lily Manor","1","Lavish Gifts","Spend 4 xxPROGRESS and 8 xxLUXURY",,"Domain"
"Whispers at Lily Manor","1","Listening In","Spend 4 xxFOOD",,"Espionage"
"Whispers at Lily Manor","1","A Night to Remember","Spend 3 xxLUXURY and 3 xxMANA",,"Diplomacy"