region,trigger,name,tags,threats,skill,defense,overcome,difficulty,attack,bodytext,@mission_image
"xxREDBANK","xxWINTER","The Necromancer","Foe, xxSTARTING","##NBSP##xxSTABILITY##NBSP##xxSORCERY##NBSP##",xxLORE,"##NBSP##xxTWOxxSIXxxSIXxxSIX##NBSP##","xxOVERCOME","4","##NBSP##xxPSYCHExxPSYCHExxPSYCHExxPSYCHE##NBSP##","xxOVERCOME Unlock Oniri. Burn card. YYY xxRIGHT Every character in region takes xxPSYCHE condition if there is a pair in xxSORCERY pool.","..\images\obstacles\marica_bogdan_necromancer.jpg"
"xxREDBANK","xxSUMMER","Doom Under Sightrock","Foe, Eldritch","##NBSP##xxSORCERY##NBSP##",xxCOMBAT,"##NBSP##xxONExxTWOxxSIX##NBSP##","xxOVERCOME","6","##NBSP##xxBODYxxBODYxxBODYxxBODY##NBSP##","xxRIGHT All characters in region take 3 xxPSYCHE for each xxSIX in xxSORCERY pool.","..\images\obstacles\eldritch_entity_chaz_cartier.jpg"

"xxSETTLED","xxSUMMER","Forager's Tome","Tome, Forager, xxSTARTING","##NBSP##xxSORCERY##NBSP##",xxLORE,"##NBSP##xxSIX##NBSP##","xxOVERCOME","2","##NBSP##xxPSYCHExxPSYCHExxPSYCHExxPSYCHE##NBSP##","xxRIGHT All characters in region take xxPSYCHExxBODY and create xxSORCERY asset at this location. YYY xxOVERCOME If there are no forager cards in play, unlock Yasmina.","..\images\obstacles\joifish_wildcraft_grimoire.jpg"
"xxSETTLED","xxSUMMER","Friends in Low Places","Diplomat, xxSTARTING","##NBSP##xxDIPLOMACY##NBSP##",xxRAPPORT,"##NBSP##xxFOUR##NBSP##","xxOVERCOME","2","##NBSP##xxPSYCHExxPSYCHE##NBSP##","xxRIGHT Characters at this location may take xxDIPLOMACY dice from pool and use them as action dice.","..\images\obstacles\ruben-algoet-blackheart-company.jpg"
"xxSETTLED","xxSPRING","Hogel","Diplomat, xxSTARTING","##NBSP##xxDIPLOMACY##NBSP##",xxRAPPORT,"##NBSP##xxFOURxxFOUR ##NBSP##","xxOVERCOME","6","##NBSP##xxPSYCHExxPSYCHE##NBSP##","xxRIGHT Move to location with most asset dice. Remove 1 asset die from this region.","..\images\obstacles\lily_manor_character.jpg"
"xxSETTLED","xxWINTER","Elisa","Diplomat, xxSTARTING","##NBSP##xxSORCERY##NBSP##",xxLORE,"##NBSP##xxFOURxxFIVExxSIX##NBSP##","xxOVERCOME","6","##NBSP##xxPSYCHExxPSYCHE##NBSP##","xxRIGHT Place xxSORCERY asset at this location and all characters in region take 1 xxPSYCHE.","..\images\obstacles\druid.png"
"xxSETTLED","xxFALL","Inadequate Defenses","Unit, xxSTARTING","##NBSP##xxMILITARY##NBSP##",xxTACTICS,"##NBSP##xxTHREExxTHREExxTHREE##NBSP##","xxOVERCOME","6","##NBSP##xxBODYxxBODY##NBSP##","xxRIGHT One character at a xxREDBANK or xxSETTLED location takes 2 xxBODY.","..\images\obstacles\inadequate_defenses.jpg"

"xxEMPIRE","xxWINTER","Tatiala's Gambit","Resistance, xxSTARTING","##NBSP##xxESPIONAGE##NBSP##xxESPIONAGE##NBSP##",xxCOMMAND,"##NBSP##xxONExxTWOxxTHREExxFIVE##NBSP##","xxOVERCOME","5","##NBSP##xxPSYCHExxPSYCHExxPSYCHE##NBSP##","xxRIGHT Clear the xxESPIONAGE resource pool. YYY xxOVERCOME Lower xxSTABILITY threat track by 3. Burn card.","..\images\obstacles\amber_hand.jpg"
"xxEMPIRE","xxFALL","Wrath of the Autarch","Spy, xxSTARTING","##NBSP##xxMILITARY##NBSP##xxMILITARY##NBSP##",xxCOMBAT,"##NBSP##xxTWOxxTWOxxTWOxxSIXxxSIX##NBSP##","xxOVERCOME","6","##NBSP##xxBODYxxBODYxxBODY##NBSP##","xxRIGHT All unlocked characters take a xxPSYCHE condition. YYY xxOVERCOME Lower xxESPIONAGE threat track by 3. Burn card.","..\images\obstacles\autarch_ascendant.jpg"
"xxREDBANK","xxWINTER","Stone and Blood","Foe, Eldritch, xxSTARTING","##NBSP##xxSORCERY##NBSP##xxSORCERY##NBSP##",xxTACTICS,"##NBSP##xxTHREExxTHREExxFIVExxFIVE##NBSP##","xxOVERCOME","6","##NBSP##xxBODYxxBODYxxBODYxxBODY##NBSP##","xxRIGHT All characters in region take 2 xxBODY. YYY xxOVERCOME Lower xxMILITARY threat track by 3. Characters in region take a xxBODY condition. Burn card.","..\images\obstacles\polina-hristova-rockdemon.jpg"
"xxSETTLED","xxFALL","Sapphire Djinn","Issue, xxSTARTING","##NBSP##xxSTABILITY##NBSP##xxSTABILITY##NBSP##",xxRAPPORT,"##NBSP##xxTWOxxTHREExxFOURxxFIVE##NBSP##","xxOVERCOME","5","##NBSP##xxPSYCHExxPSYCHE##NBSP##","xxRIGHT Remove all xxSTABILITY assets from play. YYY xxOVERCOME Lower xxDIPLOMACY threat track by 3. Burn card.","..\images\obstacles\lily-abdullina-adar.jpg"
"xxSETTLED","xxWINTER","The Severing","Trap, Eldritch, xxSTARTING","##NBSP##xxMILITARY##NBSP##xxTECHNOLOGY##NBSP##",xxLORE,"##NBSP##xxFIVExxFIVExxSIXxxSIX##NBSP##","xxOVERCOME","6","##NBSP##xxPSYCHExxPSYCHExxPSYCHExxPSYCHE##NBSP##","xxRIGHT All characters in region take 2 xxPSYCHE. YYY xxOVERCOME Lower xxSORCERY threat track by 3 and all characters with xxLORE > 0 take a xxPSYCHE condition. Burn card.","..\images\obstacles\anna-dluzewska-181103-magical-forrest-01-sign.jpg"
"xxSETTLED","xxWINTER","Stealer of Hope","Foe, Eldritch, xxSTARTING","##NBSP##xxSTABILITY##NBSP##xxDIPLOMACY##NBSP##",xxCOMBAT,"##NBSP##xxONExxONExxTWOxxTWO##NBSP##","xxOVERCOME","6","##NBSP##xxBODYxxBODYxxBODYxxBODY##NBSP##","xxRIGHT All characters in region take 3 xxPSYCHE. YYY xxOVERCOME Lower xxTECHNOLOGY threat track by 3. Characters at this location take a xxBODY condition. Burn card.","..\images\obstacles\joshua-brian-smith.jpg"