mission,ctriggers,title,tags,text,rsummary,blocka,blockb,blockc,blockd,blocke

"Starting Location",,"xxSPOTLIGHT Undari's Tower","Sorcery, Red Bank","The vile mage left behind all manner of useful recipes. Provided you have the will to use them.",,"xxACTION Blue Toad Compress. Remove a minor xxBODY condition by spending xxMANA equal to condition value."
"Starting Location",,"xxSPOTLIGHT The Great Hall","Diplomacy, Red Bank","Fuscus has been known to entertain large groups in the Great Hall.",,"xxACTION Rest and Relaxation. Remove a minor xxPSYCHE condition by spending xxFOOD equal to condition value."
"Starting Location",,"xxSPOTLIGHT Amber Lodge","Espionage, Red Bank, Urban","The repurposed barracks of the Amber Hand has become Thea's personal offices.",,"xxACTION Map Hall. Look at the top asset card on either draw pile. Take into hand or place back on top of asset draw pile."
"Starting Location",,"xxSPOTLIGHT Lavender Mill","Technology, Red Bank","The great hub of Red Bank bustles with activity.",,"xxACTION The Exchange. Spend 3 xxPROGRESS to gain three resource dice of any type."
"Starting Location",,"xxSPOTLIGHT Sightrock Keep","Military, Red Bank","At the edge of your vision, looking west, you can just make out Eastkeep wall... looming.",,"xxACTION Tactical Planning. Draw the top two asset cards from your asset draw pile."

"The Necromancer of North Oaks",,"1) Gray River","Wilderness","The Gray River rolls through the shade of the dense elms, carrying dark earth from deeper within the forest.",,"xxACTION Mapping the Land. Test (Survival xxPROGRESS).","xxACTION Logging Operation. Gain 2 xxTIMBER dice."
"The Necromancer of North Oaks",,"2) Mirror Woods","Wilderness","The dense woods appear to shimmer and twist, a byproduct of the fallen soldiers rotting beneath the roots.",,"xxACTION Battles Against the Undead. Test (Combat xxPROGRESS)."
"The Necromancer of North Oaks",,"3) Undari's Tomb","Dungeon","The mage's resting place has become a source of evil. The old wards were not strong enough.",,"xxACTION Dark Sigils. Test (Lore xxPROGRESS).","xxACTION Source of the Undead. Take 2 xxDISCORD to move any number of Restless Dead to this location."
"The Necromancer of North Oaks",,"4) Outer Fernbrake","Red Bank, Urban","Simple folk band together in the shadow of darkness.","xxFIRE","xxACTION Community Building. Test (Command xxPROGRESS).","xxFIRE Casualties of the Undead. If there any Restless Dead here, lose 1 xxSTABILITY."

"Doom Under Sightrock",,"1) Lush Fields","Wilderness","Text",,"xxACTION Bonds of friendship (Rapport xxPROGRESS).","xxACTION Gain 2 xxFOOD dice."
"Doom Under Sightrock",,"2) Salmon Run","Wilderness","Text",,"xxACTION A spreading fear (Command xxPROGRESS).","xxACTION Test (Survival xxPROGRESS)."
"Doom Under Sightrock",,"3) The Weird Rock","Dungeon","Text",,"xxACTION Journey under the rock (Survival xxPROGRESS).","xxMOON One character at this location is shaken."
"Doom Under Sightrock",,"4) Pool Beyond Space and Time","Dungeon","Text",,"xxACTION Eldritch echoes (Lore xxPROGRESS)."

"The Sunriders",,"xxSPOTLIGHT Spirit Lake","Sorcery, Faction","The clear waters of Spirit Lake reflect back the wisdom of ancestors. Feeding the lake earns the Sunriders' respect.","xxAIR","xxAIR Gain one Mana Die."

"The Sunriders",,"1) Horsethief Meadows","Wilderness","Feats of martial prowess take place across the wide open plains.",,"xxACTION First Impressions. Test (Command xxPROGRESS).","xxACTION Rangers of the South. Spend 5 xxPROGRESS to increase xxSTABILITY track by one."
"The Sunriders",,"2) Hogel Manor","Urban","For a Sunrider, Hogel's decorations and appointments are almost gaudy, and his demeanor doubly so.",,"xxACTION Wine and Loathing. Test (Rapport xxPROGRESS)."
"The Sunriders",,"3) Song Bluff","Wilderness","Amongst the Sunriders, honor and family are more important than diversity of thought.",,"xxACTION Discussing Battle Plans. Test (Tactics xxPROGRESS)."
"The Sunriders",,"4) Spirit Lake","Wilderness","The clear waters of Spirit Lake reflect back the wisdom of ancestors. Feeding the lake earns the Sunriders' respect.",,"xxACTION Twilight Swordplay. Test (Combat xxPROGRESS).","xxACTION Speak with the Dead. Spend 4 xxMANA to burn any issue in play at a Sunriders location."

"Gravewood",,"1) First Haven","Urban","Text",,"xxACTION Old suspicions (Thievery xxPROGRESS).","xxACTION Spend 3 xxLUXURY to discard one threat."
"Gravewood",,"2) Green Haven","Urban","Text","xxFIRE","xxACTION The iconoclast (Command xxPROGRESS).","Effect: All characters increase their Thievery by Gravewood disposition while at least one character is at this location.","xxFIRE One character at this location is angry."
"Gravewood",,"3) Spinner Lakes","Wilderness","Text",,"Island of Apples (Rapport xxPROGRESS).","xxACTION Spend 8 xxLUXURY to gain one xxSECRETS."
"Gravewood",,"4) Maplewood","Wilderness","Text",,"Tales of myth (Lore xxPROGRESS).","xxACTION Gain one xxTIMBER."

"Into the Cold",,"1) The Rosy Freetrader","Imperial, Urban","A popular meeting place for both the poor and wealthy of Eastkeep.",,"xxACTION Rumors of a frozen hell (Disguise xxPROGRESS).","xxACTION Cause a Scene. Move one Graycloak to the Rosy Freetrader."
"Into the Cold",,"2) Map Hall","Imperial","Somewhere amongst the piles of maps and ledgers are useful Imperial plans.",,"xxACTION In the vaults (Thievery xxPROGRESS).","xxACTION Spend 2 xxPROGRESS to gain two dice of any one resource."
"Into the Cold",,"3) House of Copper","Dungeon","Through rings of smoke move cloaked figures willing to provide all manner of things for the right price.",,"xxACTION A possible ally (Rapport xxPROGRESS)."
"Into the Cold",,"4) Guild of Secrets","Imperial, Urban","If there is a nexus of evil in Eastkeep, it is most certainly the guild of secrets.","xxAIR","xxACTION Payback (Combat xxPROGRESS).","xxAIR If possible, move a Graycloak here from another location."

"Ballad of Eight Ears",,"1) Pine Bluff","TBD","TBD",,"xxACTION Deer hunt (Survival xxPROGRESS)."
"Ballad of Eight Ears",,"2) Rocky Outcrop","TBD","TBD",,"xxACTION Polymorphic deception (Lore xxPROGRESS)."
"Ballad of Eight Ears",,"3) Gray Fores","TBD","TBD",,"xxACTION Eight ears revealed (Combat xxPROGRESS)."
"Ballad of Eight Ears",,"4) Azure Peak","TBD","TBD",,"xxACTION Imperial surveys (Tactics xxPROGRESS)."

"Burgan Vale",,"1) Shimmerhall","TBD","TBD",,"xxACTION Audience with Elisa (Command xxPROGRESS)."
"Burgan Vale",,"2) Arankh","TBD","TBD",,"xxACTION Legend of the Palimpsest (Lore xxPROGRESS)."
"Burgan Vale",,"3) Blue Rock","TBD","TBD",,"xxACTION The academic (Survival xxPROGRESS)."
"Burgan Vale",,"4) Lower Wash","TBD","TBD",,"xxACTION Silence and contemplation (Disguise xxPROGRESS)."

"Sowing Rebellion",,"xxSPOTLIGHT Whitehold","Espionage, Imperial, Urban","Graycloak headquarters in the breadbasket of the Empire.",,"Add +1 to any tests made at this location."

"Sowing Rebellion",,"1) Freeguilder Inn","Imperial","Where everybody - every single body - knows your name.","xxAIR","xxACTION A dark rot (Disguise xxPROGRESS).","xxAIR One character at this location is weary."
"Sowing Rebellion",,"2) Dowling Farm","Imperial","Nexus of Imperial discontent.",,"xxACTION The Resistance (Command xxPROGRESS).","xxACTION Spend 5 xxLUXURY to gain one xxSECRETS."
"Sowing Rebellion",,"3) Whitehold","Imperial, Urban","Graycloak headquarters in the breadbasket of the Empire.",,"xxACTION The war machine (Tactics xxPROGRESS).","All guards (obstacles) at this location have +1 xxDISCORD."
"Sowing Rebellion",,"4) Under Whitehold","Imperial","The caverns below Whitehold have both riches and traps.","xxFIRE","Raiding imperial coffers (Thievery xxPROGRESS).","xxACTION Take two xxDISCORD to gain one xxLUXURY die.","xxFIRE One character at this location is wounded."

"Tragedy and Conspiracy","xxCOMMAND","1) Outer Fernbrake","Red Bank","The people of Outer Fernbrake are growing to distrust Thea's leadership.","xxEARTH","xxEARTH If there are any Violent Locals here, lower Stability."
"Tragedy and Conspiracy","xxLORE","2) House of Lavender","Red Bank, Urban","Swirls of intoxicating smoke tie together the deals and favors with an ephemeral bond.","xxWATER","xxACTION Spend 2 Mana dice to draw a new Achievement. Discard one of the two Achievements already in play to the bottom of the Achievement draw pile."
"Tragedy and Conspiracy","xxSURVIVAL","3) Graywash Spring","Red Bank, Wilderness","The river out of North Oaks winds its way through dense forests and hidden ruins.","xxAIR"
"Tragedy and Conspiracy","xxCOMBAT","4) Sparrow Keep","Imperial, Dungeon","How is it that a nexus of such evil activity was allowed to grow so large?","xxFIRE","xxFIRE Take 1 Discord for each Autarch Spy at this location."

"Whispers at Lily Manor","xxDISGUISE","1) Wrenhouse","Imperial, Urban","Both regret and conviction in equal measure.","xxAIR","xxACTION Move an obstacle to this location."
"Whispers at Lily Manor","xxTACTICS","2) Hall of Brass","Faction","Zarrah greets all newcomers in the great hall of world renown.","xxFIRE","xxFIRE If there are any issues here, one character at a mission location is Angry."
"Whispers at Lily Manor","xxRAPPORT","3) Goldspike","Faction","Who knows what future badness brings but the keeper of secrets in a chamber of gold?","xxWATER","Effect: Any issues here have +1 xxTRACKING."
"Whispers at Lily Manor","xxTHIEVERY","4) Beetle Burrough","Urban","You look like someone who wants to know a secret?","xxEARTH"